description,statusesCount,followersCount,favoritesCount,friendsCount,name,type,screenName,location,lang
"Married 36 fun filled years, two children, two grandsons. Love sharing the gift of life! Have donated 101 times at the Indiana Blood Center.",22,553264,10,600927,Mike Whitaker,celeb,MikeWhitaker,"Indiana, USA",en
Celebrating sciences. Greening the environment | INAICTA 2012: Creative & Innovative New Media | We Communicate Green | redaksi@hijauku.com,60632,232339,1001,1000,Hijauku.com,,Hijaukudotcom,Indonesia,en
Eternizando  memórias. Immortalizing memories. Be part of it ! Faça parte #Alzheimerebook  Os tweets não são assistência médica. The tweets are not health care.,10118,193543,5717,53521,Alzheimerebook,foreign,Alzheimerebook,info@alzheimerebook.org,pt
"Entrepreneur, Advisor, Investor, Podcaster: https://t.co/BjBUF8sbyM, @GetSoundGuard + https://t.co/3ueXRTLkgr, @JoolMedia + https://t.co/pnEhmR90nP, @StartupSense <ed><U+00A0><U+00BD><ed><U+00B1><U+00BB>jonahlupton <ed><U+00A0><U+00BD><ed><U+00B3><U+00B7> jonahlupton",63991,1111117,44988,1221811,Jonah Lupton <ed><U+00A0><U+00BC><ed><U+00B7><U+00BA><ed><U+00A0><U+00BC><ed><U+00B7><U+00B8>,celeb,JonahLupton,info@jonahlupton.com,en
Fashion PR. TV Personality. CEO @abisfitness. Snapchat abigail_clarkex Management: @jaw_mgmt. Press: dermot@candidpublicity.com,18817,144857,7165,1018,abigail clarke,,abigail_clarke,Insta | @Abigail_Clarke,en
<ed><U+00A0><U+00BC><ed><U+00BE><U+00A5> TOWIE <ed><U+00A0><U+00BD><ed><U+00B3><U+00A7> Agent: ellen@mokkingbird.com instagram @georgiakousoulou. <ed><U+00A0><U+00BD><ed><U+00B1><U+00BB>snap: gkatiek <ed><U+00A0><U+00BD><ed><U+00B1><U+0097><ed><U+00A0><U+00BD><ed><U+00B1><U+0099> Clothing - @myuniquelook,30174,407089,6610,1722,Georgia Kousoulou,celeb,MissGeorgiakx,instagram - @georgiakousoulou,en
Proud Husband & Dad. Used to play rugby (ish). Now cycle (ish) but far too slowly...... “To live is the rarest thing in the world. Most people exist” -,36697,163111,148,630,Will Carling,,willcarling,Instagram @wdccarling,en
"Design Psychology Author REALTOR® Speaker. Love sacred spaces, writing, traveling & driving fast cars #JOYexpress https://t.co/qTVAAN568z CEO<ed><U+00A0><U+00BC><ed><U+00B7><U+00BA><ed><U+00A0><U+00BC><ed><U+00B7><U+00B8>",107230,203777,7041,165049,Jeanette JOY Fisher,,JeanetteJoy,"Instagram, Los Angeles, Austin",en
Help needy pets and wildlife <U+01B8><U+0335><U+0321><U+04DC><U+0335>¯<U+0328><U+01B7> #animals #wildlife #conservation #environment #nature #pets,3698,147075,441,146704,Help the Animals,,HelpAnimals,International,en
"Daily low carbon economy news, facts, live events & #ClimateTV leader interviews. Follow #CWNYC #RE100 #EP100 #Under2Coalition and #StatesandRegions",42812,122018,2573,2916,The Climate Group,,ClimateGroup,International,en
Fighting corruption with the world's best cross-border journalism by 190+ reporters in 65 countries. #PanamaPapers #SwissLeaks #LuxLeaks #OffshoreLeaks,12422,113666,705,810,ICIJ,,ICIJorg,International,en
Carbon News...The Carbon Economy Experts. Our new website launching soon. http://t.co/oIRS1kBJmY,1872,106660,0,18602,CARBON NEWS,,co2news,International ,en
Internet Marketing Consultant & Social Media Geek. Helping business grow organically !,772,197620,133,179348,Virendra Verma,,VirendraSMO,Internet,en
"Easily, Effortlessly Make 3% To 9% Or Higher ROI (Cash Basis) Every Few Days, Utilizing StockSafari's Price Forecasts (and before using any options, futures).",7786,100822,19,43303,StockSafari Freeware,,forecastall,Internet Space,en
Views and opinions expressed here are the BBC's. Not my own. I live in  New York.,23765,1485383,116,1186,richard bacon,celeb,richardpbacon,"iPhone: 0.000000,0.000000",en
"Web Designer, Web Development and Bespoke Software Developer specialising in Open Source technologies such as Java, PHP and jQuery. I love technology :-)",9833,106842,141,2808,Ashish Kulkarni,,ashishkulkarni,"iPhone: 56.107868,-3.930868",en
"Trying 2 tweet the best of Iraq, Iraqis & their history and culture. To promote mutual influences between Mesopotamia & the whole world; in the past & present.",52398,1007035,1050,981966,#IRAQesque,bis,Iraqesque,Iraq,en
"Digital Marketing Strategist, speaker & Sunday Independent columnist. Love to connect! https://t.co/DcgDD5et41",76535,137482,9728,606,Paul O'Mahony,,PaulOMahony,Ireland,en
Leading Content Marketing Agency for the Global Tech and Business Industry.,65088,138500,1805,121424,markITwrite Tech,,markITwrite,Ireland & England,en
"Sosyal Medya Uzmani & Dijital Stratejist, Yazar; @Turkcell, @HWPTR Dergisi, @usmedorgtr #USMED Ege Bölge Baskani, #BEÜ |<U+261E>REKLAM & ILETISM<U+21AA>info@alaattincagil.com",2943,3013826,32535,1105393,Alaattin Çagil <ed><U+00A0><U+00BC><ed><U+00B7><U+00B9><ed><U+00A0><U+00BC><ed><U+00B7><U+00B7>,foreign,AlaattinCAGIL,"Istanbul, Izmir",tr
Snapchat: efekuruscu reklam:efekuruscu@gmail.com,17365,690567,14304,686159,Efe Kurusçu,foreign,efekuruscu,"Istanbul, Türkiye",tr
Recognised as No 1 Global Teen influencer... Part of @ITKIDSOFFICIAL Meet the Vloggers Kids Blog/Press Enquiries: hello@prbox.co.uk,3065,431004,24180,106218,Amazing Arabella,celeb,Arabelladaho,IT KIDS HQ <ed><U+00A0><U+00BC><ed><U+00BD><U+0095><ed><U+00A0><U+00BC><ed><U+00BC><U+0088><U+2B50><U+FE0F><U+2764><U+FE0F><ed><U+00A0><U+00BD><ed><U+00B8><U+008D><ed><U+00A0><U+00BD><ed><U+00B1><U+008A><ed><U+00A0><U+00BC><ed><U+00BE><U+0082><ed><U+00A0><U+00BE><ed><U+00B6><U+008B>,en
"The greatest technological experience of the world in a festival of innovation, creativity, science, entrepreneurship & entertainment.",14990,206380,2966,3790,Campus Party,foreign,campusparty,Italia,es
"DJ & Producer.
Don't keep calm and twerk hard.
https://t.co/MhR2vAC3TJ",40114,273455,915,29157,Alex Corsi,foreign,djalexcorsi,Italia / España,it
"KBO. if it's good enough for Churchill, it's good enough for me. For work enquiries, please contact Michael Cohen at MPC Entertainment: https://t.co/kyjZgeCZ2D",18920,142876,494,719,Mark Pougatch,,markpougatch,Itinerant,en
Weather presenter on ITV News. Previously Sky News & forecaster at the Press Association & Meteogroup: Europe's leading private weather company,28054,150156,5616,627,Lucy Verasamy,,LucyWeather,ITV News,en
The official Twitter home of ITV. Please note that tweets to @ITV may be displayed on online and on air by ITV. Full interactive terms at https://t.co/baHiOti6xN,51085,2078843,8868,5271,ITV,bis,ITV,ITV Towers,en
"Facebook Likes, Twitter-Instagram Followers & Youtube Views/likes in cheapest price. WhatsApp/Call: +91 9983118888 & Skype: ddsaharan https://t.co/PzRNwoWo5m",737,135322,716,61111,Dinesh Kumar Saran,,ddsaharan,"Jaipur, India",en
"BBC journalist, based in Johannesburg. Previously in Bangkok, Singapore, Nairobi, Moscow and Tbilisi. Author of The Mayor of Mogadishu.",8231,169987,196,1682,andrew harding,,AndrewWJHarding,Johannesburg,en
"IG<ed><U+00A0><U+00BD><ed><U+00B3><U+00B7>: ulrichjvv. Humanitarian, Anthropologist, Social & Eco Activist. Radio | TV | Print | Web | Digital Media. One human race. One love. One with nature.",9630,427916,220676,260375,Ulrich J van Vuuren,celeb,UlrichJvV,"Johannesburg, South Africa",en
"Africa's largest Federation Official tweets,the home of the toiling classes across the world,with more than 2million membership...Amandla!",168161,102040,25773,68527,@COSATU Today,,_cosatu,"Johannesburg, South Africa",en
"Governor of Kaduna State. 
Member of The All Progressives Congress Board of Trustees. 
Tweets are my views not those of the APC.",40642,1154203,419,768,Nasir Ahmad El-Rufai,celeb,elrufai,"Kaduna, Nigeria",en
#B2B marketer. Helping companies navigate sales and marketing channels. #KCproud Chiefs and Royals fan. #helpNOTsell #buildingproducts,31137,125486,607,75976,Elton Mayfield,,EltonMayfield,Kansas City,en
"I create and provide free, high-res inspirational wallpapers focusing on a large and growing variety of topics on success, motivation, and self-improvement.",2457,224379,154,235857,Success Wallpapers,,successwalls,"Kansas City, KS",en
<ed><U+00A0><U+00BD><ed><U+00B1><U+0094> Entertainment Executives. Celebrity Marketing Specialists. | <ed><U+00A0><U+00BD><ed><U+00B3><U+00B7> IG: STANDISH913 <ed><U+00A0><U+00BD><ed><U+00B4><U+008C>| 8 Instagram Marketing Success Secrets Revealed EBOOK LINK BELOW! <ed><U+00A0><U+00BD><ed><U+00B1><U+0087>,44206,102950,10708,10864,Standish Promotions,,Standish913,"Kansas City, KS",en
Mobile Apps. Part of @PinsightMedia.,6333,5900089,48,44888,OneLouder Apps,bis,OneLouderApps,"Kansas City, MO",en
"CEO of 9.0 Magazine, 9.0 The Underground, #Bogardthat, No Limit East, A/V Producer, Digital Dist. Co, Believer #CowboyNation #Lakers # 8186499660 #Twittergoons",1396238,1089878,100,968856,Producer 9-0,celeb,nine_oh,"Kansas City, MO",en
"Small business marketing consultant, speaker and author of Duct Tape Marketing, Duct Tape Selling, The Referral Engine and The Commitment Engine.",23463,116297,2800,12764,John Jantsch,,ducttape,"Kansas City, MO",en
"Welcome to the Official International Account of #EXPO2017 Astana ""Future Energy"". «Solutions for Tackling Humankind’s Greatest Challenge» #EXPO2017Astana",2061,123482,1397,1288,EXPO 2017 Astana Int,,Expo2017_Int,Kazakhstan,en
MP for Westmorland and Lonsdale & Former Leader of the @LibDems,70971,276780,9753,12928,Tim Farron,,timfarron,Kendal,en
#IOTNQD is a 10 year passion project from #IndieFilmmaker AD LANE @crazyDlane Currently on indiegogo: https://t.co/QkTKx9LMhZ #supportindiefilm #NOCGI #HORROR,149677,186269,5765,196020,#IOTNQD,,IOTNQDfilm,Kent,en
"You cannot report crime here - call 101/999. This is our only county feed, all others are not Kent Police. Follow our local accounts - https://t.co/Vk0hMMuwEL",21206,145673,1182,450,Kent Police (UK),,kent_police,"Kent, South east England, UK",en
chubby mzungu,31668,199244,416,718,Giles Coren,,gilescoren,"Kentish Town, obviously.",en
Follow Support Libraries! for our latest product offerings. Always great prices!,17426,121724,20,9176,Support Libraries,,SupportLib,Kentucky,en
"Official archive of the UK government. Discover our online collections, research guides and educational resources spanning 1,000 years of history",9317,112110,5483,455,National Archives UK,,UkNatArchives,"Kew, London",en
"Baroness Brady of Knightsbridge CBE Business Woman of the Year Government Business Ambassador, Best Selling Author, The Apprentice Inspirational Global Speaker",3521,231576,353,242,Lady Brady,,karren_brady,"Knightsbridge, London",en
Digital Content Creator #HGTV & #DIYNetwork's House Counselor #dailycoffeecrew @knowhowstudios -somewhat irreverent. :insta @laurie_march https://t.co/mvrPE6xkmy,36800,496233,44357,32903,Laurie March,celeb,Laurie_March,LA Baby...,en
The official twitter feed for Lancashire Police. Not monitored 24/7. To report crime call 999 in an emergency or go online at https://t.co/XpDpTGcmfy,22540,158258,1916,465,LancsPolice,,LancsPolice,"Lancashire, England",en
"On 95.5, 103.9, 104.5FM, DAB & Freeview channel 720. Sport: @BBCLancsSport. Live updates: https://t.co/J9CihA2k4x",84096,118007,1837,1209,BBC Lancashire,,BBCLancashire,"Lancashire, UK",en
Writer - Entrepreneur - Investor - Lover of Life & Wife - Unboxed. Unleashed and unabashedly patriotic. Nothing implied by Tweets RTs or FAVs,11703,115413,7478,105937,Hal Marston  :^\,,BirdBrayn,Land of Ahhhs ,en
Proud Supporters of our 45th President @realDonaldTrump Creator of The Trump Card Builders of The @BorderWallUSA Wall Defenders of Freedom #Support45,17886,303955,34463,198270,Support 45,,WeSupport45,"Las Vegas, NV",en
My passion is training dogs. I am the President of Sit Means Sit Corporate (Las Vegas) and Owner with my business partner.,15697,125419,0,151049,Alfredo Rivera,,AlfredoSMS,"Las Vegas, NV",en
https://t.co/rhA6yLPe4M,284,117534,94,65880,Louis K. Burrell,,KingOfGanoderma,"Las Vegas, NV",en
"ebbhuggins@kw.com
#CommercialRealEstate, #CRE, #RealEstate, #Land, #Rentalproperties, #LandForSale, #HousesForSale",14830,110958,7549,65399,Michael E.B. Huggins,,lvre4sale,"Las Vegas, NV",en
"Peak Performance Trainer, #Podcast Host, Author, Speaker, Business Strategist, #Tech Geek, #blockchain, @TheCavaliers Alumni, & Die-Hard @Cubs Fan",263716,447175,1297,18272,Richard Krawczyk,celeb,TheMrBlueprint,"Las Vegas, NV USA",en
Keep updated with all the latest news from the IOC.,3490,112188,182,543,IOC MEDIA,,iocmedia,Lausanne. Switzerland,en
Question of Sport geek with a motto of HEALTH by far outweighs WEALTH! Please email info@mattdawson.online for any enquiries.....,15719,260203,2097,500,Matt Dawson,,matt9dawson,Leafy West London,en
All the news and sport for Leeds and beyond fast and first.,93511,189789,1359,4680,YorkshireEveningPost,,LeedsNews,Leeds,en
"#135K #GameDev #IndieDev #Charity #Music #Science #Robot builder. @jack at twitter hired @femfreq!
I dont h8 wt I dont bleev. 3rd Wave #feminism is #Bullshit!",137120,116812,8333,142640,David G griffiths,,Bensonix,Leeds,en
"Official Twitter feed for BBC Radio Leeds, your BBC in West Yorkshire. LISTEN: 92.4FM, 103.9 FM, 774AM, DAB & Freeview with local news, sport, travel & weather.",82061,122265,4761,1321,BBC Radio Leeds,,BBCLeeds,"Leeds, UK",en
Proud father! Player at @LCFC. Founder of @FoxSoccerAcadNY. A @pumafootball athlete. Be The Attitude @NoFuchsGivenLtd! #NoFuchsGiven,973,145501,1857,91022,Christian Fuchs,,FuchsOfficial,"Leicester, England",en
Labour Mayor of Greater Manchester,11028,174358,130,1561,Andy Burnham,,AndyBurnhamGM,"Leigh, Greater Manchester",en
"Robin Harrison MD Dolly Char (UK) Ltd Entrepreneur, franchisor, seeking franchise business partners  https://t.co/UCdZp55JOo  MUFC  NT EH",40040,106743,838,60374,Dolly Char UK,,rocketrobin2,Lincoln,en
On air. On the ground.,97063,562211,36009,9794,BBC Radio 1Xtra,bis,1Xtra,Listen live,en
Formula 1 racing driver for Red Bull Racing,1131,578683,642,309,Max Verstappen,foreign,Max33Verstappen,little bit of everywhere ,nl
First Labour Councillor for Liverpool County Ward. Mayoral Lead for Older People.  Member of GMB and Unite Union and CO-OP member,38952,782161,12106,60945,Gerard Woodhouse,celeb,GerardWoodhous1,Liverpool,en
Head of Club and Supporter Liaison at Liverpool FC.,42176,386394,20,690,Tony Barrett,,TonyBarrett,Liverpool,en
TV chick <ed><U+00A0><U+00BD><ed><U+00B0><U+00A5> Blogger- Dog Lover & Entrepreneur with a big heart • INSTA https://t.co/Koy97SEOhU •:• @NoMoreKennels PRESS ENQ @CarolynPR,23663,306158,13187,109256,Rebeckah Vaughan,,RebeckahVaughan,Liverpool,en
Spirit of Shankly - Liverpool FC Supporters Union. Recognised Supporters Trust.,8827,122671,936,24814,Spirit of Shankly,,spiritofshankly,Liverpool,en
"Profiler & Criminologist - Paranormal Research & Ghosthunter - Liverpool U.K.- https://t.co/Vjxnw8VhIK , You want me  You got it !",960,112951,63,7166,Tony Roberts,,hauntedprofiler,Liverpool,en
"Low cost, UK based #WebDesign & Search Engine Optimisation. Get your free website #SEO analysis here: https://t.co/bcbSRUht5e",85222,218141,29762,94901,Red Website Design,,Red_Web_Design,"Liverpool, England",en
We told you they lied,30629,130917,10421,134640,Justice For The 96,,TheHoodedClaw66,"Liverpool, England",en-gb
"The latest Liverpool news, sport, weather and events from the Liverpool Echo. We're also on Facebook http://t.co/vad0B12E",154171,367341,1949,1316,Liverpool Echo,,LivEchonews,"Liverpool, UK",en
"Professor of Public Engagement in Science at Uni of Birmingham. Physical anthropologist, author, broadcaster. All views my own & I assert my right to share them",17023,119431,14166,880,Prof Alice Roberts,,theAliceRoberts,location: Crypt of Lieberkuhn,en
Chief football reporter @TheSunFootball | Presenter of Sunday Supplement @skysports | Premier League insider @NBCSportsSoccer,16046,217826,2447,595,neil ashton,,neilashton_,Location: London,en
News and analysis with a global perspective.  Subscribe here: https://t.co/owztJzwlmm,114217,21572111,305,157,The Economist,news,TheEconomist,London,en
"News, features and analysis. For world news, follow @BBCWorld. Breaking news, follow @BBCBreaking. Latest sport news @BBCSport",332130,8586034,30,100,BBC News (UK),news,BBCNews,London,en
Mum/wife/Broadcaster/designer. Patron of @PostPals @Coppafeelpeople @TylersTrust @PrincesTrust. Ambassador for @GarnierUK #TheOliaEffect and @Cath_Kidston,19541,7410383,1853,572,fearne cotton,celeb,Fearnecotton,london,en
I was introduced to this by a twitter legend! Ambassador for Garnier UK and Diet Coke GB..,5877,7335726,62,273,Holly Willoughby,celeb,hollywills,London,en
The need for independent journalism has never been greater. Become a Guardian supporter: https://t.co/EWg9aqA7PQ,365135,6674822,153,1115,The Guardian,news,guardian,London,en
"Yes, I am still indeed alive, contrary to rumour, and am performing the silly walk in my new app http://t.co/16QGv879Ew",3814,5607858,343,191,John Cleese,celeb,JohnCleese,London,en
Former Drummer with ThrimbleWeed and the Vegetations,24409,5368309,276,8401,Jonathan Ross,celeb,wossy,London,en
"One of the world's leading museums devoted to contemporary design in every form from architecture and fashion to graphics, product and industrial design.",14413,4233019,10039,2384,Design Museum,bis,DesignMuseum,London,en
"I talk on Radio X in the morning and write things on social media, sometimes with pictures. Oh, and the radio show has videos too. Isn't that clever!",12229,3932920,296,215,Chris Moyles,celeb,ChrisMoyles,London,en
,8702,3562154,391,2451,Tulisa,celeb,officialtulisa,London,en
The official account for Sky Sports Premier League.,120256,3424506,253,772,Sky Sports PL <ed><U+00A0><U+00BD><ed><U+00B1><U+0091>,sport,SkySportsPL,London,en
"This is the official Twitter account for the Mayor of London, Sadiq Khan. Tweets before 9 May 2016 are from the previous Mayor",8681,2962208,57,3264,Mayor of London,pol,MayorofLondon,London,en
"News stories, features and updates from the FT. For headlines follow @financialtimes. Our customer service team is @FTcare.",170685,2937203,31,814,Financial Times,news,FT,London,en
The Times does fashion. Instagram: https://t.co/t9Fh2nI66o,10048,2472225,168,120524,Times Fashion,news,TimesFashion,London,en
"Host of the Radio 2 Breakfast Show, creator of CarFest, custodian of 500 Words. But mostly punching way above his weight in marriage department.",14849,2421553,33,241,Chris Evans,celeb,achrisevans,LONDON,en
"Comedy actress and writer, dog owner and wannabee pop star.",6026,2390249,272,307,Miranda Hart,celeb,mermhart,London,en
"News, comment and features from The Independent.",583106,2306963,13,1107,The Independent,news,Independent,London,en
"This is the David Mitchell who's in Peep Show and things, not the novelist or the Cumbrian origamist.",6897,2175103,9,532,David Mitchell,celeb,RealDMitchell,London,en
The June/July 2017 issue is out now https://t.co/rhRAwxphjc https://t.co/51Msd8L5Sr,25384,2135858,5835,7910,Creative Review,bis,CreativeReview,London,en
"News, reviews and author interviews plus tweets from the @Guardian and Observer books team",36915,2117293,733,1268,Guardian Books,bis,GuardianBooks,London,en
A toe in the water. Now I'm up to my neck. Instagram: khanjemima,4770,2114781,2126,678,Jemima Goldsmith,celeb,Jemima_Khan,London,en
Chap.,6926,2085872,91,329,Rob Brydon,celeb,RobBrydon,London,en
The global authority on design,38248,2062895,1041,3114,Wallpaper*,bis,wallpapermag,London,en
"Official posts from The Economist on Business, Finance and Economics. Subscribe to our Money Talks podcast here https://t.co/3cTKbmDJha",58771,2035209,66,155,The Economist,news,EconBizFin,London,en
Publishing the best books and authors for 80 years.,24185,1703201,10308,308734,Penguin Books UK,bis,PenguinUKBooks,London,en
I am involved in the making of documentaries. Warning: Some tweets may contain irony.,2607,1656528,1086,1493,Louis Theroux,celeb,louistheroux,London,en
"Finding the best of London culture, daily. For in-depth coverage of your favourite topic, follow one of our section accounts here:  https://t.co/SrVN9ngEy0",33555,1490378,12205,5301,Time Out London,bis,TimeOutLondon,London,en
"A museum of the world, for the world #Hokusai #Scythians https://t.co/62S4qPJXt8 House rules: https://t.co/Cuh8WM0b4U",16620,1453605,18246,50837,British Museum,bis,britishmuseum,London,en
<ed><U+00A0><U+00BC><ed><U+00B7><U+00AC><ed><U+00A0><U+00BC><ed><U+00B7><U+00A7>UK • Watch all 3 series of #CATASTROPHE on @All4. <ed><U+00A0><U+00BC><ed><U+00B7><U+00BA><ed><U+00A0><U+00BC><ed><U+00B7><U+00B8>US • Watch it on @AmazonVideo: https://t.co/FrhexCgWCi,40310,1451348,378086,2492,rob delaney,celeb,robdelaney,London,en
These views are my own. Management -sam.gregory@bigredtalent.com https://t.co/Gvq7lwpXiV,27228,1407723,5437,2347,Scott Mills,celeb,scott_mills,London,en
"Art Lover, LFC1892 follower, Technologist, Tea Lover Northener so a sense of humour is mandatory. Existentialist, Realist, Optimist,JF96",39101,1386180,51240,64343,Dil,celeb,Asamsakti,London,en
"Never miss a story again. News, sport and entertainment from The Sun, as it happens. Give us a like on Facebook too: https://t.co/VsBj6xNXLG",284010,1309973,631,387,The Sun,news,TheSun,London,en
"Official Olympics and Paralympics channel - Sport, culture, behind the scenes information and opinion on the London 2012 Olympic and Paralympic Games",3778,1294983,4,1090,London 2012,bis,London2012,London,en
Underwhelmist.,10406,1183892,0,516,Charlie Brooker,celeb,charltonbrooker,London,en
aceeventphotos007@gmail.com add my facebook page https://t.co/NhYUWTAlLj,123262,1065474,24995,1028118,Ace Event Photos,bis,photo_ace,London,en
"Science, health and environment news from the @Guardian. Plus, independent comment and analysis from our network of expert science bloggers",33622,1050494,117,2253,Guardian Science,news,guardianscience,London,en
"Your guide to everything London, Handpicked London",22838,1043340,552,46723,Handpicked London,bis,LDN,London,en
"London's Metropolitan Police Service.  Please do not report crime here, call 101, tweet @MetCC or visit our website. In an emergency always call 999.",16658,1021998,0,752,Metropolitan Police,gov,metpoliceuk,London,en
"The best of our journalism.
Subscribe here: https://t.co/Kq4ItERnQC
Speak to our customer service team: https://t.co/VIDSflmdIL",153945,1010162,1736,660,The Times of London,news,thetimes,London,en
"Entrepreneur, Investor, founder of the UK's 1st Enterprise Academy. Creator of American Inventor in US & Star of Dragons' Den in UK.",7817,999692,8,547,Peter Jones,celeb,dragonjones,London,en
Team GB is the Great Britain and Northern Ireland Olympic Team run by the British Olympic Association,34716,891584,6781,1780,Team GB,sport,TeamGB,London,en
The world's most influential architecture and design magazine.,72316,856547,424,15394,Dezeen,KEEP,Dezeen,London,en
"Our website is designed to help individuals, celebrities, millionaires and billionaires source their refined shopping needs. #millionaire, # marketplace",313,806374,55,56844,Premium Solutions,bis,PremPremium,London,en
"Foreign & Commonwealth Office (FCO). We work on world affairs for the UK Government and lead on promoting & protecting British people, prosperity & influence",29231,793280,1174,29398,Foreign Office <ed><U+00A0><U+00BC><ed><U+00B7><U+00AC><ed><U+00A0><U+00BC><ed><U+00B7><U+00A7>,gov,foreignoffice,London,en
Books; articles: https://t.co/AOdtXKVYWQ; films; https://t.co/dk8MZPUCS9,3708,782367,5702,1385,Alain de Botton,celeb,alaindebotton,London,en
"Sport news, comment, video and more from the @Guardian. For all your US sports needs, follow @GdnUSsports, and Australian sport @GdnAusSport. IG: guardian_sport",143723,746841,61,1539,Guardian sport,sport,guardian_sport,London,en
http://t.co/xNo7rgb8JJ - Home of the Daily and Sunday Express,374871,670212,11,511,Daily Express,news,Daily_Express,London,en
"Breaking news alerts from the UK around the clock. For global updates, follow @breakingnews.",15697,659240,14,628,Breaking News UK,news,BreakingNewsUK,London,en
"Author of 'The Establishment' and 'Chavs', Socialist, Guardian columnist. Losing my Northern accent. My views etc... https://t.co/RThqdX7tJ0",121574,653369,1449,4187,Owen Jones,celeb,OwenJones84,London,en
"The Quran is not a book of science but a book of ‘signs,’ i.e. ayats.

talktoquran@gmail.com",8007,630118,260,75,The Noble Quran,bis,TheNobleQuran,London,en
"Secret London is a community of Londoners, all sharing #London's greatest little places and secret nooks and crannies. Check them out: https://t.co/uKgYxiffU2",12323,595046,277,19806,secret_london,bis,secret_london,London,en
"12.30pm weekdays on @ITV All tweets to @loosewomen may be used on air, including video & pics. Terms: https://t.co/TKGDROZaN2",25873,587692,10558,2839,Loose Women,bis,loosewomen,London,en
"First for celebrity news. 'Like' our Facebook page at https://t.co/Iv7kY0e1aR, follow us on Instagram at ok_mag and on Snapchat at okmaguk.",330151,566762,511,68251,OK! Magazine,bis,OK_Magazine,London,en
"Design news, views, inspiration and jobs @DesignWeek_Jobs. Tweets from Tom, Sarah and Aimee. https://t.co/l7jKy5WBbw https://t.co/Ok1EEMZAOD",15665,556495,583,5641,Design Week,KEEP,Design_Week,London,en
Breaking news and updates on top London stories from the newsdesk of the @EveningStandard. Follow our other accounts at https://t.co/5nrRg0ZT,156226,540597,32,889,Evening Standard,news,standardnews,London,en
"All the latest from the foreign desk at the @Guardian in London and all points north, south, east and west",62141,528709,101,396,Guardian World,news,guardianworld,London,en
"The latest travel news, deals and videos plus inspiration for your next trip",6339,520204,127,35614,The Times Travel,bis,timestravel,London,en
