description,statusesCount,followersCount,favoritesCount,friendsCount,name,type,screenName,location,lang
See the whole picture with @ABC News. Facebook: https://t.co/ewMNZ54axm Instagram: https://t.co/pPlGmNHztz,176283,11325941,458,742,ABC News,news,ABC,New York City / Worldwide,en
News and announcements from the Federal Reserve Bank of New York,4354,125349,8,55,New York Fed,,NewYorkFed,"New York City, USA",en
Investment Relations to Public & Private Companies Since 1982  Over 5 Million Stock Investors in Our Database,314,116771,1167,53045,Internet Capital Inc,,ICAP11,New York NY,en
"Links, Ideas and Conversation from the TreeHugger hive mind, the latest in modern green.",41743,362684,642,6773,TreeHugger.com,,TreeHugger,"New York, Everywhere",en
Victor Samra (@vsamra3) and Cortney Cleveland (@cleveoutloud) at the easel. Please tweet us your questions or comments.,11055,4986779,4130,3383,Museum of Modern Art,bis,MuseumModernArt,"New York, New York",en
"@NYTimes Columnist/Editor & @SquawkCNBC Co-Anchor. Author, Too Big To Fail. Founder, @DealBook. Co-Creator, BILLIONS @Showtime. Co-Chair @NYPL's BLC. Proud Dad.",3588,759955,8694,2131,Andrew Ross Sorkin,celeb,andrewrsorkin,"New York, New York",en
Life begins at home.,26818,495566,1048,2391,House Beautiful,KEEP,HouseBeautiful,"New York, New York",en
"TooNiceStocks is not a licensed Financial Adviser or Brokerdealer. Our tweets are our own ideas, opinions & should never be taken seriously.",4964,165621,0,110275,TooNiceStocks,,TooNiceStocks,"New York, New York",en
"Environmental Defense Fund works with businesses, government & communities to create lasting solutions to the most serious enviro problems. #ActOnClimate",20278,160081,869,4293,EDF,,EnvDefenseFund,"New York, New York",en
"Wife, mom, grandma, women+kids advocate, FLOTUS, Senator, SecState, hair icon, pantsuit aficionado, 2016 presidential candidate.",9889,17225460,1170,761,Hillary Clinton,celeb,HillaryClinton,"New York, NY",en
Breaking news and features from the WSJ.,208527,14508115,1294,1074,Wall Street Journal,news,WSJ,"New York, NY",en
"Official Twitter account of http://t.co/iVGiXAHX, homepage for the world's business leaders.",163615,13343077,5335,5555,Forbes,news,Forbes,"New York, NY",en
Official tweets by https://t.co/XyGsGk67aO. Ideas worth spreading.,23193,10256149,3701,514,TED Talks,bis,TEDTalks,"New York, NY",en
Official account of #UnitedNations. Get latest information on the UN. Follow us on Instagram: unitednations. #GlobalGoals #StandUp4HumanRights,57747,9234089,819,1149,United Nations,gov,UN,"New York, NY",en
Your source for original reporting and trusted news.,136168,6008999,268,430,CBS News,news,CBSNews,"New York, NY",en
The leading source of global news and information for more than 75 years.    Facebook: https://t.co/oeDi7xACU7   Snapchat: https://t.co/suOkoNb0KE,117937,4977904,744,2971,NBC News,news,NBCNews,"New York, NY",en
"Stay relevant. News and analysis on politics, science, technology, and culture.",115001,3340774,2905,75,Newsweek,news,Newsweek,"New York, NY",en
Official Twitter feed for the Fast Company business media brand;  inspiring readers to think beyond traditional boundaries & create the future of business.,165177,2284409,5448,3969,Fast Company,bis,FastCompany,"New York, NY",en
"What you need to know. 

For corporate news from Business Insider and INSIDER follow @BI_Corporate.",404334,2069990,481,185,Business Insider,news,businessinsider,"New York, NY",en
"Mom of Charlotte & Aidan, Married to Marc, Advocate, Author, Teacher, @ClintonFdn & @ClintonHealth & @HealthierGen, New Yorker",8015,1840179,113,499,Chelsea Clinton,celeb,ChelseaClinton,"New York, NY",en
"The official Twitter of Bloomberg Businessweek. Covering the business world like no one else.

Subscribe here: https://t.co/OhdS2EhSbk",51333,1537490,455,450,Businessweek,news,BW,"New York, NY",en
The Wall Street Journal's Business editors share the latest breaking news and their insights on what matters most in business and finance.,64308,1457572,4,395,WSJ Business News,news,WSJbusiness,"New York, NY",en
Serving as a trusted partner to our clients by responsibly providing financial services that enable growth & economic progress. Customer service: @AskCiti,14334,896954,1775,302,Citi,bis,Citi,"New York, NY",en
News from #TED and its global community of passionate thinkers. Follow @TEDTalks for daily talks and ideas.,12888,894131,1317,17677,TED News,news,TEDNews,"New York, NY",en
"Financial, tech, media and other business news from The New York Times. Banner photo by Jason Henry.",158234,786405,897,384,NYT Business,news,nytimesbusiness,"New York, NY",en
In-depth insight and analysis on international affairs and U.S. foreign policy since 1922.,30567,609294,167,2187,Foreign Affairs,news,ForeignAffairs,"New York, NY",en
1987–2017: Celebrating the Power of 30 Years Supporting Social Innovation,13742,489037,5367,9932,Echoing Green,celeb,echoinggreen,"New York, NY",en
"Latest news on energy, environment, animals and more.",61735,439756,1184,1139,HuffPost Green,news,HuffPostGreen,"New York, NY",en
For animal people.,45792,397856,13121,3209,The Dodo,bis,dodo,"New York, NY",en
Breaking news from The Wall Street Journal.,7730,384928,0,43,WSJ Breaking News,,WSJbreakingnews,"New York, NY",en
The Council on Foreign Relations is a resource for foreign policy news and analysis. CFR takes no institutional positions on policy. Follows <U+2260> endorsements.,41929,343447,39,12460,CFR,,CFR_org,"New York, NY",en
"American Management Association is the world leader in management development, advancing your skills to boost your business success: http://t.co/AtDEzFrHrH",48949,287716,540,115501,American Management,,AMAnet,"New York, NY",en
,11516,282779,1250,147,Dan Rather,,DanRather,"New York, NY",en
"Official Page of Chef Chris Nirschel (Culinary Bad Boy) NYC executive Chef, featured on VH1, CNN, NBC, Fox, Dr. OZ Better TV, Food Network. CEO of @nycatering.",4435,234077,339,5685,Culinary Bad Boy,,CulinaryBadBoy,"New York, NY",en
"New York Times bestselling author, serial entrepreneur, Fortune 500 consultant, TV personality, keynote speaker, career and workplace expert & startup advisor.",27608,213259,51,130889,Dan Schawbel,,DanSchawbel,"New York, NY",en
"Fast Company's Ideas section: World-changing ideas and innovation. We talk about the environment, energy, tech, food, health, transportation, and more.",51700,209238,631,864,Fast Co. Ideas,,FastCoIdeas,"New York, NY",en
The official twitter feed of IBM Watson. Tweets by Mary Reisert and Jeremy Hodge. Follows the IBM Social Computing Guidelines.,10348,188606,3634,1662,IBM Watson,,IBMWatson,"New York, NY",en
Architecture & Design At All Scales,11195,187573,1453,2092,Metropolis Magazine,,MetropolisMag,"New York, NY",en
"Inside the world of luxury real estate, via The Wall Street Journal. Tweets by @Leigh_KC",10123,179543,205,217,WSJ Mansion,,WSJRealEstate,"New York, NY",en
"UN Publications is the source for over 5,000 titles produced by the United Nations and its key agencies.",1591,170657,107,958,UN Publications,,unpublications,"New York, NY",en
"Residential real estate news from The New York Times, covering the five boroughs and beyond.",16660,116061,14,137,NYT Real Estate,,nytrealestate,"New York, NY",en
CA Technologies helps customers succeed in a future where every business — from apparel to energy — is being rewritten by software.,25373,114943,9159,16293,CA Technologies,,CAinc,"New York, NY",en
Say it together and be heard. The first crowdspeaking platform for amplifying messages that matter.,3978,109872,948,299,Thunderclap,,ThunderclapIt,"New York, NY",en
"New York Yoga, Spa & Wellness Guide For Personal Growth, Stress Management, Diet, Nutrition & Well-being. Like us on FB: https://t.co/Ac7TuGbtxP",60200,100716,2,78644,NYWellnessGuide,bis,NYWellnessGuide,"New York, NY",en
"Anchor, Global Markets Editor Mornings with Maria @MorningsMaria 6-9 AM ET M-F on @FoxBusiness Network & @SundayFutures 10:00 AM ET Sundays @FoxNews.Channel",19272,332981,7492,1207,Maria Bartiromo,,MariaBartiromo,"New York, NY ",en
"Architizer is an online destination that is revolutionizing architecture with its vast building database, daily content, Source marketplace & A+Awards.",33561,906673,4326,2275,Architizer,KEEP,Architizer,"New York, NY // Global",en
"View the latest news and breaking news U.S.A,World, Sports Business Entertainment Arts e-commerce B2B EU-ASIA/

https://t.co/o8ZTZ02510
https://t.co/YgOR8WxdFn",190020,527026,232752,343310,NEWS.U.S.A.@cwn24 +e,news,EnergyDrinkRen,"New York, USA",en
Official Twitter account of the Office of the Spokesperson for United Nations Secretary-General @antonioguterres,15344,444530,120,1023,UN Spokesperson,gov,UN_Spokesperson,"New York, USA",en
New York asbestos removal/controlled demolition project monitor & air technician. A<U+2666><U+FE0F>Q<U+2666><U+FE0F> <ed><U+00A0><U+00BD><ed><U+00B1><U+00BB> Snapchat jamesgrimaldi.7 https://t.co/ppZqt2B9xX,17465,235590,6124,220830,James Grimaldi,,newyorkgrimaldi,"New York, USA",en
"Personal Injury Lawyer, Real Estate Attorney, Immigration Attorney: Family Petition / Green Card / Artist Work Visa / Waivers - Hablamos Español",16345,126144,606,116584,Lawyer,,AGoodLawyer,"New York, USA",en
We Are America..And We love United State.,6014,186326,309,139130,U S A,,USA89591851,New York.,en
"Former Prime Minister and former MP for Helensville. Authorised by G Hamilton, 41 Pipitea St, Wellington.",4267,236538,40,2374,John Key,,RtHon_JohnKey,New Zealand,en
"Latest #NorthEast news, sport (#NUFC, #SAFC and Gateshead) travel, weather, events and more from The Chronicle newspaper in Newcastle.",114102,154282,2668,1357,The Chronicle,,ChronicleLive,"Newcastle upon Tyne, UK",en
Spotlighting best practices and innovative uses of Twitter by journalists and newsrooms.,2932,2908723,171,26,Twitter News,bis,TwitterNews,Newsrooms everywhere,en
Instagram @christinelbleakley,2207,430872,559,673,Christine Lampard,celeb,clbleakley,Newtownards/London,en
EcoGuy. Big on: Arts. Biz. Co-ops. Domaining. Empathy. Ethics. Feminism. Gaia. Inner God. Joy! Justice. LOA. LOHAS. Music. NBA. Om. Qi. New Media. Tech. Vegan.,420613,411749,219139,60756,Norman Buffong,celeb,NormanBuffong,"Niagara Region, Canada",en
#Twitter #Hilfe #eBook #Affilliate #Partnerprogramm #Web2 #Video #Coaching #Schulung #Webinar #Leads #Traffic #SEO #followback http://t.co/0g86gPYmwA,62821,118687,4,134558,DocGoy Twitt-Erfolg,foreign,twitt_erfolg_de,Niedersachsen,de
MAGAZINE OF HOME & STYLE | Founder @lyndareeves | Snapchat: @houseandhomemag,22684,176821,2454,5460,House & Home,,HouseandHome,North America,en
"NYT Best Selling Author, Inc. Mag's Top 50 Leader, CEO of Life, Speaker, Humorist, World Traveler, Soccer Fan, Father, Rascal!",15607,213181,1214,161993,Chris Brady,,RascalTweets,North Carolina,en
Law Firm Finance Systems Consultant and Lecturer - tweet weekly about things that interest me and hopefully you.,65119,157515,5285,157608,Sean Melvin,,ThatBlokeSean,North London and Valencia,en
"'' 13.82 billion years, a microwave super-hero! Now I just flit from galaxy to galaxy, having fun and making a nuisance of myself '' http://t.co/jNN07TUn7X",457,151545,3,146304,Microwave Man,,MicrowaveMan,"North Walsham, Norfolk, UK",en
BBC regional news in the North West,37055,192114,372,1213,BBC North West,,BBCNWT,North West England,en
"News, breakouts and paid IR services. Tweets are not stock recommendations. Davisresearch2003@yahoo.com",15433,457224,98,34059,Excitingstocks,bis,EXCITINGSTOCKS,Northeast US,en
"Started a few SaaS companies, @CrazyEgg, KISSmetrics & Quick Sprout with @NeilPatel. Two are self-funded & the other is venture backed. I enjoy helping people.",54307,221821,17838,176333,Hiten Shah,,hnshah,Northern California,en
"Live Video Marketing Expert, Keynote Speaker, NY Times Best-Selling Author, Top 5 Social Influencer. DM for Speaking/PR only.Get your LIVE video playbook below!",42629,843975,30932,589997,Joel Comm,celeb,joelcomm,Northern Colorado,en
"Passionate, multi-genre writer, author, copywriter, poet, and editor here to show you the power of compelling writing! Contact marcelproust37@hotmail.com now!",4218,190135,2781,23079,socrates37,,socrates37,"Northridge, California",en
#Weather host and owner on #xtremexm #radio. Always looking for #science and #scifi related #podcasts for network. Also owner of weather.st ! #winter #blizzard,40617,191417,863,31928,Nick Szankovics <ed><U+00A0><U+00BC><ed><U+00BC><U+00A4><U+FE0F>,,weather_talk,"Norwich,CT USA",en
Notts CCC and England cricketer. Instagram: https://t.co/uoCKhZhVMg,10343,1095880,1616,669,Stuart Broad,celeb,StuartBroad8,Nottingham,en
"@skysportsboxing Analyst - Commentator. @partypoker Ambassador. Love a game of poker and a good scrap, but now I just talk a good one. All my own opinions <ed><U+00A0><U+00BD><ed><U+00B1><U+008A><ed><U+00A0><U+00BC><ed><U+00BF><U+00BC>",3360,649310,1661,634,Carl Froch MBE,celeb,Carl_Froch,Nottingham,en
"MD @octopusintell, the global Competitive Intelligence Agency. #cufc #nffc #shorinkan Digging around answering questions @octopusfor supporter & @PluralistsClub",17005,181169,416,155767,Graeme Dixon,,GraemeDixon_,"Nottingham, England",en
"The official twitter account for the Nottingham Post, providing local news, sport & entertainment. Part of Trinity Mirror.",93071,127214,649,316,Nottingham Post,,Nottingham_Post,"Nottingham, UK",en
"Higher #GoogleRankings, More #Traffic & Increased Profits and that's not just what #seo77 have to offer their clients http://t.co/cv3ClwbNCD info@seo77.co.uk",15067,366024,107,5887,seo77,,seo77,"Nottingham, United Kingdom ",en
This account isn't monitored 24/7 so please don't report crime here - call 999 in an emergency or 101 instead.,21020,119467,2700,1015,Notts Police,,nottspolice,Nottinghamshire,en
Humanist. Opiner. Artificer. Code wrangler. Bit banger. I have the death sentence in seven languages. http://t.co/SJdB7u57BR,24113,381942,3888,238908,Kas Thomas,,kasthomas,Now living in Los Angeles.,en
"The ITV regional news programme covering the North West of England and the Isle of Man, plus our politics and current affairs programme The Granada Debate.",40131,258622,1468,12085,ITV Granada Reports,,GranadaReports,NW England & IOM,en
'Life is not about waiting for the storm to pass... it's about learning to dance in the rain.' :-) http://t.co/6vtJRRSOys,221885,518141,6886,519094,Ted Rubin,celeb,TedRubin,NY,en
"Ismi Dr Jacquescoley. Je suis global citizen. Therefore, I'm a vehement opponent of racism,  tokenism,  imperialism et gun violence. Filthy lucre est not my God",28497,127286,8780,19713,DrJacquescoleyMusic,,jacquescoley,"NY, Middle East, LA, Toronto",en
Entrepreneur,13809,109047,816,289,Andrew Wong,,andyrwong,"NY, SF, LA",en
B.A. Philosophy. Ancient historian WBAU Radio. Traveled 7 continents +1. Author of BEYOND RELIGION:OUTSIDE THE BOX. Have done many T.V. Commercials,2009,1126687,694,929666,MACHAVELLI MEDICI,celeb,machavelli7,NYC,en
Your source for top international news and analysis.,140728,217637,9,170,Reuters World,,ReutersWorld,NYC,en
"Host and editor, Cause & Effect",61069,178946,1907,1785,Felix Salmon,,felixsalmon,NYC,en
"Network for Architects and Designers to find, manage, and share products.",10769,166227,41,3388,Designer Pages,,designerpages,NYC,en
"Life Coach, Relationship Expert, Author and Breakup Ninja. Expect fun, quick tips on Life, Love, Dating, Relationships, Sex and other random cool stuff.",5535,104650,21,106200,Life Coach Jay,,JayCataldo,NYC,en
Always learning...,712,127558,0,136943,BBoyAirMax™,,BBoyAirMax,NYC Metro,en
Energize your life... in three easy steps!,2595,137245,13,135771,Megmark™,,Megmark,NYC Metro/Global,en
People fascinate me...,144322,388930,500,67888,Joshua Estrin,,JoshEstrin,NYC/Miami,en
"The official home of the #UCL on Twitter. Spanish: @LigadeCampeones  U19: @UEFAYouthLeague 
YouTube: https://t.co/0i6D56XWMm",50142,16521760,1022,490,Champions League,sport,ChampionsLeague,"Nyon, Vaud",en
"I'm a husband, father, actor, director, and a climate change advocate with an eye on a better, brighter, cleaner, more hopeful future for all of us.",31874,3314476,6742,1554,Mark Ruffalo,celeb,MarkRuffalo,NYS,en
"Founder and CEO, O'Reilly Media. Watching the alpha geeks, sharing their stories, helping the future unfold.",42347,1988309,4712,1745,Tim O'Reilly,celeb,timoreilly,"Oakland, CA",en
"NY Times, WSJ & USA Today Bestselling author. Former pro athlete & USA Team Handball player. Top 50 Podcast- 2 million downloads a month -Instagram LewisHowes",43264,128384,33824,36226,Lewis Howes,,LewisHowes,Ohio boy in NYC and LA,en
Forbes Recognized #Workplace & #HR Resource. Formerly @blogging4jobs. Disrupting the workplace since 2005.,92490,114865,1099,82321,Workology,,workology,"OKC | SF | Austin, TX ",en
"The UK's biggest design trade event 20-23 September 2017, Olympia London. #100design #designexperience",13309,110874,656,765,100% Design,,designlondon,Olympia London,en
"Police Volunteer UK Funny,caring,serious,opinionated,humorous, support 999 and 911 family,respect matters quote this because I show it.",25554,309310,27624,17467,JG <ed><U+00A0><U+00BD><ed><U+00B1><U+008D>,,FABSITEUK,On the Internet watching,en
Independently Major. || #Gwop4Entertainment X #Grind2Rise Promotions Present #QualityOverQuantity2 #YearOf20<ed><U+00A0><U+00BE><ed><U+00B4><U+0094>,40610,1627213,1276,560745,TheRealSleepSkee,celeb,SleepSkee,On The Move,en
Before the world ended I used to do comedy and write novels.,911,167783,135,1588,Mark Watson,,watsoncomedian,On tour until 2043,en
"A Entertainer, Presenter, Traveller, That Guy From Periscope And A Broadcaster. Usually LIVE On: https://t.co/0srrfEUGvC",43122,166430,38996,163962,JONATHAN M. MELLOR,,JonathanMellor,On TV / Usually In London - UK,en
Founder of @ourlegenduk .. @btsportrugby tea boy! Views on here are only mine ...generally happy,11513,144782,73,341,Austin Healey,,IamAustinHealey,On twitter/Rutland,en
"Since 2002, BETTER LIVING has been the premier digital lifestyle brand and TV show dedicated to #TRAVEL, #FOOD, #HOME & MORE!",1470,218716,1629,109822,Better Living,,BetterUpdates,OnBetterLiving@gmail.com,en
Cross Media Visual Pro  #creative  #design #architecture #advertising #promotion #branding #ux #ui #communication #trends inanycasejustcontact@gmail.com,12163,130155,3951,73703,AndriyKoval,,AndriyKoval,Online,en
I&I am Oregon Man. Handmakes Tie Dyes w/ Wife for: Made By Hippies Tie Dyes! Peaceful Patriot <U+262E> Waging Heavy Peace: Be wise as a serpent and harmless as a dove.,12353,128288,742,129417,Made By Hippies,,MadeByHippies,Oregon,en
CEO Marketing Nutz #Speaker Trainer Strategist Love God Family Friends Beach & Life! #Forbes Top 10 #SocialMedia #Influencer https://t.co/a2PrsAXywL,124128,303318,5295,140138,Pam Moore,,PamMktgNut,"Orlando, FL",en
The Data Optimization Tool (DOT) is the umbrella product line consisting of a patent-pending engineering process.,10287,175213,0,224030,Salventrex,,DOTProduct,"Orlando, FL",en
"Our patent-pending product is the Data Optimization Tool (DOT). Enables charting, analysis, and optimization of any real-time or historical data.",10874,172458,0,219072,DOT Trader,,Salventrex,"Orlando, FL",en
This is the sale divison of Salventrex.  Follow us for the breaking company news.,10352,166820,0,213338,DOT Trader,,SalventrexSales,"Orlando, FL",en
"Journalist, Human Rights activist, Author, Columnist, Political analyzer, Editor in Chief and founder of the @TheOsloTimes, Author of ""The Red Wrath"".",41096,177524,13035,42580,Dr. Hatef Mokhtar.,,HatefMokhtar,"Oslo, Norway",en
"<U+2605> rumiana naturkosmetik - Hautpflege mit den Mitteln der Natur <U+2605>
Online-Shop für ausgewählte Naturkosmetik",1530,105517,0,102670,naturkosmetik online,foreign,naturkosmetix,Ostbevern,de
"Canada’s Central bank. Promoting the country’s economic and financial welfare. Keeping inflation low, stable and predictable. En français : @banqueducanada",2441,119729,1,34,Bank of Canada,,bankofcanada,"Ottawa, Canada",en
<ed><U+00A0><U+00BD><ed><U+00B2><U+00AA> Building your Biz on #Twitter? <ed><U+00A0><U+00BD><ed><U+00B2><U+00B0> This Exact Training Gets me Free Leads Daily... https://t.co/2DDX37N3Xg #AskLalonde @WorkWithLalonde #Freedom <ed><U+00A0><U+00BD><ed><U+00B2><U+00B8>,172,241654,0,220915,Ask Lalonde <ed><U+00A0><U+00BD><ed><U+00B2><U+00B0><ed><U+00A0><U+00BD><ed><U+00B2><U+00AA><ed><U+00A0><U+00BD><ed><U+00B2><U+00B8>,,AskLalonde,"Ottawa, Ontario",en
<ed><U+00A0><U+00BD><ed><U+00B2><U+00AA> Building your Biz on #Twitter? <ed><U+00A0><U+00BD><ed><U+00B2><U+00B0> This Exact Training Gets me Free Leads Daily... https://t.co/2DDX37N3Xg #AskLalonde @RichAndFit #Freedom <ed><U+00A0><U+00BD><ed><U+00B2><U+00B8>,179,184390,1,151607,Marc M. Lalonde <ed><U+00A0><U+00BD><ed><U+00B2><U+00B0><ed><U+00A0><U+00BD><ed><U+00B2><U+00AA>,,marcmlalonde,"Ottawa, Ontario",en
"Official Twitter for Co-op Food queries, feedback, our latest deals & more. Find your local https://t.co/npRp5SBe8p, community policy, https://t.co/f7O3jU57qg",83736,113936,19990,12628,Co-op Food,,coopukfood,Our opening hours:,en
Chief Sports Reporter of the Daily Mail and Mail Online,16646,150055,413,760,Matt Lawton,,Matt_Lawton_DM,Out and about,en
Ride with #Amtrak and see where the train can take you.,189487,122299,421,467,Amtrak,,Amtrak,Over 500 Destinations,en
"home renovation enthusist/affordable housing advocate, VP Renovation Lending NMLS #260770; Guaranteed Rate NMLS #2611",10352,100935,18,100078,Dustan Shepherd,,203klender,"Overland Park, KS",en
"Author of Messy; Undercover Economist at the FT; presenter of BBC More or Less. (Please email if you want a response.) Views my own, of course.",35231,130143,315,637,Tim Harford,,TimHarford,Oxford,en
"Doctor, nerd cheerleader, Bad Science person, stats geek, procrastinator. Currently an academic at CEBM in Oxford https://t.co/B7AvuxJrGV ben@badscience.net",60337,487516,2016,2445,ben goldacre,celeb,bengoldacre,"Oxford, England",en
"Chief football writer, BBC Sport website. An official @BBCSport account. Find more at @BBCSport/Following http://t.co/kBCvfjtsVG",61301,388307,115,3937,Phil McNulty,,philmcnulty,"Oxford, England.",en
"Official Twitter account for the University of Oxford, one of the world's leading universities.",9807,374952,3419,639,Oxford University,,UniofOxford,"Oxford, UK",en
<U+2726> @MyBoxerBoyLuvez @Me_Gofficial @Twitwhizz @1LA_lady @Marc_1tt @ElieBautista @Zeyneddind #Ze @Twiterhero @mike_hblmal03 @Dutch2haze @Hiqutipie @Trutina_  #MGWV,223929,1683515,145132,443782,#LuveZsaveZdogZ,celeb,JuleZpooh,Pa  <U+2726>@Trans1110<U+2726> #AmS,en
PROUD Supporter of #PresidentTrump fighting one tweet at a time MAKING AMERICA GREAT AGAIN !! Retweeted by @realDonaldTrump #AmericaFirst <ed><U+00A0><U+00BC><ed><U+00B7><U+00BA><ed><U+00A0><U+00BC><ed><U+00B7><U+00B8><ed><U+00A0><U+00BC><ed><U+00B7><U+00BA><ed><U+00A0><U+00BC><ed><U+00B7><U+00B8>,117140,170992,125264,124789,BRIAN FRASER,,bfraser747,Pacific North West,en
Breaking news direct from @BBCScotland. For sport updates follow @BBCSportScot. On Instagram at bbcscotnews.,122555,374799,12,40,BBC Scotland News,,BBCScotlandNews,"Pacific Quay, Glasgow",en
This is the official Twitter account of chef Rick Stein.,5731,375492,1509,511,Rick Stein,,Rick_Stein,"Padstow, Cornwall",en
SNP MP for Paisley & Renfrewshire South...and proud jags fan! Won't respond to DM's. Constituents please email https://t.co/t2RY4BhVWq.mp@parliament.uk,3106,109528,2782,2550,Mhairi Black MP,,MhairiBlack,Paisley & Renfrewshire South,en
"Driving large-scale change by investing in, connecting, & celebrating social entrepreneurs & innovators dedicated to solving the world’s most pressing problems",11912,486483,3688,789,Skoll Foundation,bis,SkollFoundation,Palo Alto,en
Twitter app for iOS and Android.,25163,3035275,258,172,echofon,bis,echofon,"Palo Alto, CA",en
ShareThis powers human connections by transforming authentic human sharing behavior into actionable outputs at scale for marketers and publishers.,5354,2243604,231,4403,ShareThis,bis,ShareThis,"Palo Alto, CA",en
"We make it easy to get paid online. Our customers love how we make payments easier, faster and smoother. Support = @DueSupport",2483,118000,2048,97326,Due,,due,"Palo Alto, CA",en
The new way to design your home! http://t.co/6USxXKj3bD      http://t.co/HvlrqZUDUc,21583,293024,4173,3014,houzz,,houzz,"Palo Alto, CA ",en
#ALQUILER y #VENTA de #PROPIEDADES http://t.co/MT4a3F4u0M mas informacion contactenos al cel 507-67817815(WASAP) o escribanos info@realestatepma.com,67,519928,1,513093,REAL ESTATE PANAMA,foreign,RealestatePMA,PANAMA,es
"Singer-Songwriter: https://t.co/PMIXKYSNhX Founder, Debonaire Media | Advertising | Marketing | Consulting | Digital Media | Entrepreneur | Music Producer",13111,126272,5463,126080,Randy Ferrell,,randyferrell,"Panama City Beach, FL",en
"Interests: history, economics, veterinary science, music,film, art and philosophy. Plato believed women should be leaders. Love Mom's peach cobbler and yoga.",14886,591178,15980,91514,Pam Grier Ph.D,celeb,PamGrier,Paradise ,en
"Blockchain booster, Gold prospector, Digital Innovation ... 
https://t.co/kXGtZhfUW9
https://t.co/Qwr5Dh7oe4",6038,454964,257,89409,Pierre Paperon,foreign,Pierre_Paperon,Paris,fr
"TV Radio Host journaliste animateur @TF1, @Europe1 #sdc https://t.co/dBsvF4ypp9 https://t.co/BYAYuvDiRm Photographe compulsif",121503,1643771,16844,57726,Nikos Aliagas,foreign,nikosaliagas,Paris / Athens / Photos ,fr
"Thanks for following I love you all! Submit Tweets & Business <U+2709>: 
We don't own any content posted, anything taken down at owners request!",365,208578,8,104003,<U+10E6> Typical Girl <U+10E6>,,Glrlcrazy,"Paris, France",en
