description,statusesCount,followersCount,favoritesCount,friendsCount,name,type,screenName,location,lang
This is the official Twitter account for BBC Radio 1.,91185,2900966,21988,2506,BBC Radio 1,bis,BBCR1,UK,en
,11427,1671400,1666,9606,Glen Mercer-Rolls,celeb,GlenMercerRolls,UK,en
Official twitter channel for GOV.UK - the best place to find UK government services and information. See our social media house rules: https://t.co/hWn1BrJ50t,8850,1489862,78,1736,GOV UK,gov,GOVUK,UK,en
Leader of the Labour Party.,8367,1417234,131,2498,Jeremy Corbyn,pol,jeremycorbyn,UK,en
The official feed of the UK's top digital channel. Please note that tweets to @ITV2 may be used on air on ITV2. Full interactive terms at https://t.co/baHiOti6xN,42827,811621,7560,53771,ITV2,bis,itv2,UK,en
"We are the British Film Institute. Passionate about film. 
We use National Lottery funding to inspire people to watch, make and learn about film.",47926,754118,2237,2157,BFI,bis,BFI,UK,en
"National Trust - charity; looking after special places, for ever, for everyone. #nationaltrust",189748,733076,1062,1544,National Trust,bis,nationaltrust,UK,en
Blogging on all things luxury travel at https://t.co/XiPZBzaaUO - please contact us via the blog ( https://t.co/oFonfEaMqj ),166785,716739,19048,528614,A Luxury Travel Blog,bis,luxury__travel,UK,en
TV Presenter,35917,682809,3016,806,Ben Shephard,celeb,benshephard,UK,en
"Movie news in 140 characters (or less). The home of #Baywatch & #Transformers (in cinemas now), An Inconvenient Sequel (Aug 25).",18379,626193,3826,4976,Paramount Pictures,bis,ParamountUK,UK,en
"THE BEAT OF THE UK - The biggest tunes and freshest new music, also home of #KISSTORY and @KISSFresh",94088,618010,23875,2587,KISS FM UK,bis,KissFMUK,UK,en
"News, comment and analysis from the @Guardian's media team",58765,531395,16,120,Media Guardian,news,mediaguardian,UK,en
"We provide Practical, Direct Support for our wounded, injured & sick Service personnel, veterans, & their families. #rebuildinglives",33619,507227,24443,20114,Help for Heroes,bis,HelpforHeroes,UK,en
"Follow us for delicious recipes, food inspiration, competitions and customer service. 
Got a question? Our team is here to help!",579470,494372,3822,58434,Sainsbury's,bis,sainsburys,UK,en
ITV Football's official Twitter account. Instagram: https://t.co/CNqiNapBtx <ed><U+00A0><U+00BD><ed><U+00B3><U+00B8> Facebook:https://t.co/eLBZ6MIsgI <U+26BD><U+FE0F>,105409,452426,1424,1231,ITV Football,sport,itvfootball,UK,en
The BBC's flagship political debate programme. Use #bbcqt to get involved in the discussion.,15970,437616,103,476,BBC Question Time,news,bbcquestiontime,UK,en
Britain's best-selling news and current affairs magazine,1845,375799,157,0,Private Eye Magazine,,PrivateEyeNews,UK,en
"Official news and information from HM Revenue & Customs. If you have a tax query, please tweet @HMRCcustomers",14309,362620,2,954,HM Revenue & Customs,,HMRCgovuk,UK,en
"The official Twitter account for John Lewis. Follow for news and views from Britain's favourite retailer. For customer services, please tweet @jlcustserv",24898,346073,1120,9579,John Lewis,,johnlewisretail,UK,en
Hi. We’re O2. We know your phone's not just a phone. It's an extension of you. Which is why we're more than just a network. We've got more for you.,1085336,341595,6416,59395,O2 in the UK,bis,O2,UK,en
"Follow us for all the latest news, recipes and offers from Waitrose. We're available on Twitter whenever our shops are open.",133163,295173,15145,6231,Waitrose,,waitrose,UK,en
Instagram  olajordan • Snapchat  ola_jordan • Media enquiries contact vickie@whitemanagement.co.uk @WhiteMgmnt • My Autobiography is out now!,10926,290410,5367,368,Ola Jordan,,The_OlaJordan,UK,en
BBC Sport journalist. This is an official @BBCSport account.,2767,278063,47,460,David Ornstein,,bbcsport_david,UK,en
"The official channel of the Office for National Statistics, UK.

Contact us: https://t.co/mDcNvPIh0f

Tweets by @joannagoodwin3 and @lauren_bradders",15352,253835,2588,1370,ONS,,ONS,UK,en
"Founder of Portas Agency, and Mary's Living & Giving charity shops,broadcaster,retail expert, author of Shop Girl & highstreet campaigner.",6722,250780,1118,471,Mary Portas,,maryportas,UK,en
Refusing to ignore people in crisis.,22291,235260,4095,3589,British Red Cross,,BritishRedCross,UK,en
"Tell the world what you intend to do, but first show it. insta: p_la_y",18076,234491,12948,231276,PLAY <U+26A1><U+FE0F>,,PlayDJcity,UK,en
Do your thing for BBC Children in Need!,15485,231495,23149,1430,BBC Children in Need,,BBCCiN,UK,en
"TV Presenter, Journalist, Mum. Host of ITV's Loose Women. Contact: https://t.co/LrE6xSQBf7 02073715444               Instagram: andreamclean1",10545,222040,284,295,Andrea McLean,,andrea_mclean,UK,en
We’re here to support the Armed Forces community. We also run the #PoppyAppeal. Tweets monitored Mon to Fri 9am – 5pm. https://t.co/p7ZiqOf8ti,18327,218951,7282,637,Royal British Legion,,PoppyLegion,UK,en
"The British Council is the United Kingdom’s international organisation for cultural relations and educational
opportunities.",13796,218719,4106,247,British Council,,BritishCouncil,UK,en
"Exclusive news and views on schools, pedagogy and education policy from Tes.",60823,214727,1184,951,Tes,,tes,UK,en
ParalympicsGB is the Great Britain and Northern Ireland team that competes at the Paralympic Games. Instagram: paralympicsgb_official,15343,213639,10966,1101,ParalympicsGB,,ParalympicsGB,UK,en
Looking for a million people who think the NHS is worth protecting. Pls follow to show your support & find out more. Unofficial but run by NHS staff.,20504,209293,21973,194671,NHS Million,,NHSMillion,UK,en
Leading Britain's Conversation. Call now on 0345 60 60 973.,113281,199916,217,1472,LBC,,LBC,UK,en
"Hi, we are Mencap. Everything we do is about valuing & supporting people with a learning disability, their family and carers.@Mencap_NI & @MencapCymru",40253,196236,22810,26733,Mencap UK Charity,,mencap_charity,UK,en
"Welcome to the Debenhams Twitter page! Full of fashion, home, accessories and beauty you can match perfectly. #Matchmade",145065,193682,2653,15410,Debenhams,,Debenhams,UK,en
"The official Argos Twitter with exclusive content, offers and competitions. For customer service, use @ArgosHelpers. Go Argos.",95059,190903,2081,2096,Argos,,Argos_Online,UK,en
"Bullying UK, anti-bullying support and advice, part of @FamilyLives offering a free helpline 0808 800 2222.",41831,188176,3054,22551,Bullying UK,,bullyinguk,UK,en
"Cosmetics can save the world - if we do it right. We live for discovering the finest ingredients, campaigning constantly and protecting Mother Nature.",62981,186336,17048,1390,LUSH UK,,LushLtd,UK,en
"Building an economy that works for everyone – so that there are places in every part of the UK for people to work & for businesses to invest, innovate & grow.",17378,168774,1647,2424,Dept for BEIS,,beisgovuk,UK,en
We are a movement of people campaigning and taking direct action to protect the environment and promote peace.,32136,166476,3628,5143,Greenpeace UK,,GreenpeaceUK,UK,en
Chief Soccer Correspondent for @nytimes and author of Mister: https://t.co/PniJqXRKBs,39553,157430,34,1689,Rory Smith,,RorySmith,UK,en
"Official Twitter account for the Institute of Physics (IOP).
https://t.co/SNhOTXdOZ9",14446,157059,1086,1027,Institute of Physics,,PhysicsNews,UK,en
Stories you’ll want to share. Watch our latest doc <ed><U+00A0><U+00BC><ed><U+00BE><U+00A5>: Addicted to Protein https://t.co/pgG5Yyj8yu Instagram: bbcnewsbeat & Snapchat: bbc_newsbeat,54795,146301,1015,6838,BBC Newsbeat,,BBCNewsbeat,UK,en
"Online marketing of UK travel + tourism. Websites on hotels, B&Bs, cottages, tourist attractions etc in England, Scotland, Wales + NI. Also see @uktraveloffers",22530,146057,37,84227,UK Travel,,ukseries,UK,en
"Open to people, places, methods and ideas. The Open University provides high-quality university education to all.",17273,141485,5375,288,The Open University,,OpenUniversity,UK,en
"Mother, TV presenter, author and founder of https://t.co/qbKDy2dbpp and owner of boutique stately home location and venue https://t.co/XJEI1Ad79F",4410,139965,157,709,Sarah Beeny,,sarahbeeny,UK,en
Promote your business with us from as little as £10 for 31 days. #SocialMedia #Marketing #ukbusinessnet,167102,131978,273,109321,UK Business Network,,ukbusinessnet,UK,en
Professional filmmaker/freelance videographer. Interested in the wider world. Equality & disability campaigner. Living with autism.Views are my own,29080,129964,63974,32002,Film2240,,Film2240,UK,en
"The UK's charity for everyone's mental health, promoting good mental health for all.",19937,126035,8344,4638,Mental Health Fdn,,mentalhealth,UK,en
"A fun, flirtatious dating show hosted by Paddy McGuinness on ITV, where it really is 'No Likey, No Lighty'! Tweets using #TakeMeOut may be used on-air or online",7259,123313,4186,1873,Take Me Out,,takemeoutuk,UK,en
"Executive Editor, Politics, HuffPost UK. News, insight and analysis from the House of Commons",66562,119169,194,6741,Paul Waugh,,paulwaugh,UK,en
"We work to make sure every child and young person has the love, support & opportunity they need to reach their potential.",24939,115700,9442,3091,Action for Children,,actnforchildren,UK,en
"Official feed for Defra, UK Department for Environment, Food and Rural Affairs. Please note: we do not respond to queries on social media.",14291,113986,950,715,Defra UK,,DefraGovUK,UK,en
"A non-profit national campaign by entrepreneurs for entrepreneurs to celebrate, inspire and accelerate enterprise in the UK. Run by @CFEntrepreneurs.",20467,109394,4849,2083,StartUp Britain,,StartUpBritain,UK,en
"Writer for the Guardian on 
Football & Money, Hillsborough, Orgreave and other stories. Latest book: The Fall of the House of Fifa.",30465,108226,1016,962,David Conn,,david_conn,UK,en
"#Breaking news, developing stories from the UK’s national news and sport agency.",54735,106970,14,189,Press Association,,PA,UK,en
Labour's press team on Twitter,51193,106816,64,1302,Labour Press Team,,labourpress,UK,en
"Movement of people building a happier society by making positive changes in their personal lives, homes, workplaces and communities",13722,106806,168,2526,Action for Happiness,,actionhappiness,UK,en
Here at the Vegetarian Society we are passionate about veggie food!,21065,101952,7026,5580,Vegetarian Society,,vegsoc,UK,en
Perfect Gentleman • I like making people smile • Follow my girl she saves lives @JENSMlTH <U+2764><U+FE0F>,15384,262726,4570,201218,Mark,,MARKSMlTH,UK ,en
"Audiense delivers unique consumer insight & engagement, helping organisations grow by identifying, understanding & connecting with highly granular audiences.",23113,206834,4757,73579,Audiense,,AudienseCo,UK ,en
White island exclusive luxury designer clothing brand for men&women our brand is inspired by ibiza. A fav with celbs and DJ's ! #ibiza #ibiza2016 #ibizaclothes,12251,232437,569,229640,whiteislandclothing,,island_ibiza,UK / #Ibiza and world wide!,en
"Professional Boxer, 2 time World Champion, Snapchat: Amirkhanboxer Instagram: Amirkingkhan Founder of @AKFoundation. Contact - Enquiries@khanboxing.co.uk",22775,2087871,1538,788,Amir Khan,celeb,amirkingkhan,UK / SF Bay area / Islamabad,en
Small business advisor • Sales doyenne • Forbes listed global influencer • Mother of future England fly half • p/t Commercial Manager @newarkrufc,86819,181957,14859,116448,Deborah Lee,,debsylee,UK and Global,en
Strictly Pro. Daddy to my beautiful girl Aurélia & married to her mummy @TheZoeCole. Instagram: BrendanColeInsta. Catch me on my tour in 2017 'All Night Long',18757,162458,757,669,Brendan Cole,,BrendanCole,Uk Kiwi,en
"The Official Twitter feed of Radio 2 from @BBC - the UK's most listened-to radio station. Online, on digital radio and on 88-91 FM.",64174,628862,33918,8831,BBC Radio 2,bis,BBCRadio2,UK London,en
"F1, Olympics, Paralympics, Wimbledon, 6Nations, Equestrian  https://t.co/LGpOVQJXGn FB https://t.co/uXQBE8LUNM Contact: https://t.co/bbuRd2VIsZ",12052,271310,757,847,Lee McKenzie,,LeeMcKenzieTV,UK or globetrotting,en
"Roaming Reporter To Get The Exclusives Nobody Else Gets, Plus Linked With A Celebrity Agency",81315,103709,171,75869,Ganjo Style,,1ganjo,UK Wales,en
Runs a jolly good marketing & comms company offering top notch PR & social media. Author. Cat lover. Vegan.,51111,178386,4382,87475,Sara Stewart,,twowitwowoo,"UK, Europe, & the U.S.",en
"Sharing nature stuff, stories & news from The Wildlife Trusts - our goal is nature's recovery on land and at sea. Tweets by TWT comms team.",24245,116992,22514,968,The Wildlife Trusts,,WildlifeTrusts,"UK, Isle of Man and Alderney",en
"CEO of @Laduma VR. Formerly with BBC, Times, Warner Bros & 20th C Fox. Proud Dad & Husband",15298,242386,1620,927,Ben Smith,,BSmith,"UK, USA, SA",en
"Financial journalist, broadcaster & public speaker. Wilkie Collins expert too. Unregulated, unlicensed, and unequivocally for free speech and a free press.",74758,102091,8171,1202,Paul Lewis,,paullewismoney,UK. Usually in London.,en
"MUSIC//TOUR//CEO of @HELLZ_YEH. Causing chaos an uprawr, So come say hi IG:https://t.co/JpTQustmV3 FB:https://t.co/57AnjIzmnb",61396,245923,1942,55470,Jamie'Jay,,jamiejaysheehan,UK/BHAM-LA-ON ROAD,en
@AP Global Football/Sports Writer (Games/issues/politics). https://t.co/gIN6rOEJB1 https://t.co/LNrfyrI1Wq,51745,129176,1125,2548,Rob Harris,,RobHarris,UK-based ,en
,13705,6641039,226,639,antanddec,celeb,antanddec,United Kingdom,en
"Updates, pictures and videos from Buckingham Palace about the work and activities of The Queen and members of The Royal Family.",25892,3140999,363,512,The Royal Family,celeb,RoyalFamily,United Kingdom,en
"Breaking news and the biggest stories from the UK and around the world. Bulletins weekdays at 1:30pm, 6:30pm and 10pm on ITV. Email yourstory@itv.com",169862,1749558,447,1441,ITV News,news,itvnews,United Kingdom,en
"mum, campaigner, writer, 21st Century podcaster. We can all make the world a better place. Better Angels podcast - lots of great voices - do subscribe.",13070,1218233,3647,14776,Sarah Brown,celeb,SarahBrownUK,United Kingdom,en
"Official British Airways Twitter account. We love reading your Tweets & are here 24 hours a day, 7 days a week to help. You can also visit",799327,1079399,34,88965,British Airways,bis,British_Airways,United Kingdom,en
#Youtuber #Minister #Influencer #Actor #PublicFigure #Entertainer #YouTube #WWE #UFC https://t.co/fQBRpHivLv Contact: daminous.purity@gmail.com,166441,1004236,55429,434153,C. Mervyn Graham Esq,celeb,Daminous_Purity,United Kingdom,en
"Breaking sports news throughout the day, plus transfer rumours, sporting debates and funny pics and vids. https://t.co/Sa9jiCN3IQ & https://t.co/xC2TdLy89d",77039,998485,60,2166,talkSPORT,sport,talkSPORT,United Kingdom,en
Unique Public Service Broadcaster. Owned by you. Funded by adverts. Watch the best of Channel 4 and @E4Tweets on @All4,39265,880707,4184,8934,Channel 4,news,Channel4,United Kingdom,en
"The Home Office is the UK government's department for policing, crime, counter-terrorism and immigration.",3239,797214,0,320,Home Office,gov,ukhomeoffice,United Kingdom,en
"Updates, pictures and videos from Clarence House, about The Prince of Wales and The Duchess of Cornwall.",11229,661494,532,340,Clarence House,bis,ClarenceHouse,United Kingdom,en
"Where extraordinary music plays on @bbc.

Like us on Facebook:
http://t.co/q8yApbUn1m

Listen Live or Listen Again via the 6 Music website",111404,644967,62381,1362,BBC Radio 6 Music,bis,BBC6Music,United Kingdom,en
"The Official Take That Twitter page. Follow Mark on @OfficialMarkO, Gary on @GaryBarlow and Howard on @HowardDonald",1312,536612,0,42,Take That,celeb,takethat,United Kingdom,en
Official twitter page for Sir Ian Botham.,8890,422107,280,158,Ian Botham,celeb,BeefyBotham,united kingdom,en-gb
<ed><U+00A0><U+00BC><ed><U+00B7><U+00AC><ed><U+00A0><U+00BC><ed><U+00B7><U+00A7> Official Great Britain tourist board <ed><U+00A0><U+00BC><ed><U+00B7><U+00AC><ed><U+00A0><U+00BC><ed><U+00B7><U+00A7> Share with #LoveGreatBritain and we'll RT!,41722,364469,14584,3375,VisitBritain,,VisitBritain,United Kingdom,en
"Never get caught out by the weather! Official BBC Weather account, run by presenters and producers. Forecasts, videos and behind-the-scenes chat.",62727,358589,130,27,BBC Weather,,bbcweather,United Kingdom,en
"Digital business supporting #startups & small businesses. Our mission: to help you ""Setup, Survive and Thrive!"" Run by a #WomaninBiz @iamDeeMaria",26153,319780,2685,145354,UKStartUp,,UKStartUp,United Kingdom,en
Author & Actors @Equityuk Member. I'm in a movie with @CourteneyCox Get a copy of my book <ed><U+00A0><U+00BD><ed><U+00B3><U+009A>JACOB THE RUNAWAY KID<ed><U+00A0><U+00BD><ed><U+00B3><U+009A>Click on this link <U+27A1><U+FE0F> https://t.co/8pPrPl4fdj,26621,287335,1999,66433,Kevin Slater,,slater4353,United Kingdom,en
Strong and stable leadership in the national interest with Theresa May.,14360,283554,0,1623,Conservatives,,Conservatives,United Kingdom,en
UK Web & Mobile App Developers for individuals and SME's - contact sales@appadapt.co.uk #UK #tourism #gas #construction #builders #tradesmen #restaurant #SME,3327,282027,4517,252347,AppAdapt,,AppAdapt,United Kingdom,en
The UK’s leading professional architecture magazine. Quick sign up to the AJ daily newsletter: https://t.co/BjJ2xISEqc,47412,245907,377,64712,Architects’ Journal,,ArchitectsJrnal,United Kingdom,en-gb
#Author of +10 Inspirational #Books <U+2605> https://t.co/Nnfehvz13w  <U+2605> #Soul <U+2605> #Quotes <U+2605> #Affirmations <U+2605> #Inspiration <U+2605> #Meditation <U+2605> https://t.co/PsSbXZXovo <U+2764><U+FE0F>,144516,216379,22678,121789,Eleesha,,eleesha,United Kingdom,en
Change Britain's future with the Liberal Democrats.,30446,200554,7855,4592,Liberal Democrats,,LibDems,United Kingdom,en
"I dance, twirl, kick, & bend. <ed><U+00A0><U+00BE><ed><U+00B4><U+00B8><ed><U+00A0><U+00BC><ed><U+00BF><U+00BC><U+200D><U+2642><U+FE0F> I write books <ed><U+00A0><U+00BD><ed><U+00B3><U+009D>Design Fitness Wear <ed><U+00A0><U+00BD><ed><U+00B1><U+00AF> and am a sustainable living wannabee! <ed><U+00A0><U+00BD><ed><U+00B0><U+009D>Contact: ef@electricmanagement.co.uk",15156,192357,5531,419,Kimberly Wyatt,,KimberlyKWyatt,United Kingdom,en
"UK Government Department for Digital, Culture, Media and Sport (DCMS).
Blog: https://t.co/FuaY8JibQR
Facebook: https://t.co/jsRMgvChpO",22829,190544,1735,1100,DCMS,,DCMS,United Kingdom,en
The Official Twitter Account for The Duke of York. Tweets sent by HRH are signed - AY.,7555,178834,4514,212,The Duke of York,,TheDukeOfYork,United Kingdom,en-gb
Watch #RedBullSoapboxRace from @YourAllyPally exclusively on @DaveChannel.,45844,178352,13337,3277,Red Bull UK,,RedBullUK,United Kingdom,en
"We’re on the move! This account will be closing soon, so follow @Tesco for the latest on Tesco Clubcard and much more.",18463,176471,214,1561,Tesco Offers,,TescoOffersMore,United Kingdom,en
"We believe every child deserves a future. We do whatever it takes for children, every day & in times of crisis: transforming their lives and the future we share",37074,170419,14972,1744,Save the Children UK,,savechildrenuk,United Kingdom,en
UK Independence Party. Join us: https://t.co/eLHBdklmPB #UKIP,34403,170099,2,4718,UKIP,,UKIP,United Kingdom,en
"We use people-centred design to enable positive social, environmental and economic change.",7963,143505,1773,2650,Design Council,,designcouncil,United Kingdom,en
"Follow Now for Daily SEO Tips, Guides & Books. Try Our £50 Budget SEO Package https://t.co/zJjTOBjb75",117710,140745,628,48026,Really Simple SEO,,ReallySimpleSEO,United Kingdom,en
"A force for good since '76. Follow us for new product previews and make-up inspo. <ed><U+00A0><U+00BD><ed><U+00B2><U+008B>  Customer care available from 9AM - 5PM, Monday - Saturday",79537,139766,1761,6163,The Body Shop UK,,TheBodyShopUK,United Kingdom,en
The Royal Horticultural Society is the world's leading gardening charity; dedicated to sharing the best in gardening! #SummerGardenDays,33924,135331,42335,5061,The RHS,,The_RHS,United Kingdom,en
UK & Ireland Business Promotion. Showcase your Business to over 200K Followers. Mention & Follow @UkBizInfo @UkBizRT & @BestUKDeal for RT's <ed><U+00A0><U+00BD><ed><U+00B8><U+0080>,50921,134239,314,120819,UKBIZ Info,,UKBizInfo,United Kingdom,en
Ensuring the will of the British people is respected following our historic vote to leave the European Union. In association with @WestmonsterUK. #Brexit,13548,134051,1432,1615,LEAVE.EU <ed><U+00A0><U+00BC><ed><U+00B7><U+00AC><ed><U+00A0><U+00BC><ed><U+00B7><U+00A7>,,LeaveEUOfficial,United Kingdom,en
We help the government spend wisely. What you can expect when you follow our Twitter account: https://t.co/vP045pwDJ8,3374,128932,228,4364,NationalAuditOffice,,NAOorguk,United Kingdom,en
"Wealth Management with a wealth of experience. Follow us for news, updates and expert insights.",4018,127000,77,91,Barclays Wealth Mgmt,,barclayswealth,United Kingdom,en
Official feed of Public Health England (PHE) providing regular news updates on the work of the organisation.,10598,125654,305,586,PublicHealthEngland,,PHE_uk,United Kingdom,en
What would you tell your younger self? Charity supporting young people through positive messages & information. Follow @RYDaily for self-development.,137306,125606,167370,116001,Respect Yourself,,RespectYourself,United Kingdom,en
"Have a question about your BT products or services? Follow us and let us help! We're here 9am to 9pm Monday to Friday, 8-8pm on Saturdays and 8-6pm on Sundays.",1405513,125218,4599,2316,BTCare,bis,BTCare,United Kingdom,en
"We are The National Autistic Society, the UK’s leading charity for autistic people & their families. Get involved with #AutismTMI https://t.co/hfNKG5m7ns",15243,124432,4892,3298,Nat Autistic Society,,Autism,United Kingdom,en
This is the official Twitter account for Sony UK. Follow us to keep up to date with the latest news and information about Sony.,28754,121306,2353,2108,Sony UK,,SonyUK,United Kingdom,en-gb
Welcome to the official https://t.co/RGzjjsMRhv Twitter feed. Follow @nothssupport for all customer service inquiries.,24210,117468,7959,4146,notonthehighstreet,,notonthehighst,United Kingdom,en-gb
"Welcome to the official Royal Mail Twitter account. We're here to help 8am-6pm Mon-Fri, 8am-1pm Sat, and 9am-2pm Sun.

https://t.co/yyX6tURifk",659785,116395,39,46030,Royal Mail,bis,RoyalMail,United Kingdom,en
"We’re here for anyone living with terminal illness, and their families, with expert care, guidance & support. Support line: 0800 0902309, Mon-Fri 8-6, Sat 11-5",25026,112268,22328,10944,Marie Curie,,mariecurieuk,United Kingdom,en
<ed><U+00A0><U+00BD><ed><U+00B3><U+00BD><U+FE0F> Entrepreneur. Tips for online business. The latest news on social media marketing <ed><U+00A0><U+00BD><ed><U+00BA><U+0080>digital marketing. Increase traffic & sales https://t.co/FkRHsU8eIQ,167498,111117,49260,57185,Alvin Lindsay,,alvinlindsay21,United Kingdom,en
"Uber Support™ Leading The way In Health Care Recruitment & Advertising. Award Winning 2016 Specialist Provider For Nurses, Locums, Support Staff & Carers.",120,110078,134,3224,Kal Ash - Director,,Ubersupportltd,United Kingdom,en-gb
@OfficialPDC darts player ranked 3 in the world. Uk Open Winner. Proud house husband to @jowrighty8. Proud dad of @_JessieWright_ @SnakebiteJunior @MimiWright6,3436,107764,4020,3108,Peter Wright,,snakebitewright,United Kingdom,en
<ed><U+00A0><U+00BC><ed><U+00B7><U+00AC><ed><U+00A0><U+00BC><ed><U+00B7><U+00A7> based #Printers for all Your #Print & #Design needs: #Leaflets #Flyers #Posters #Banners free UK <ed><U+00A0><U+00BD><ed><U+00B3><U+00A6> T: 0113 350 9785 E: info@popprintanddesign.co.uk,21944,102317,7688,111785,POP Print & Design,,popprintleeds,United Kingdom,en-gb
Official Currys PC World – tweets about tech + great deals. For support please tweet @TeamKnowhowUK,28844,100082,1563,2134,Currys PC World,bis,curryspcworld,United Kingdom,en
"Entrepreneur, Property Developer, Opportunity Investor, Columnist Bristol Post, Huffington Post, Patron Lucy Air Ambulance, Judge NatWest #GBEA 2017.",23352,104128,739,780,Stephen Fear,,FearStephen,United Kingdom ,en
"UNICEF promotes the rights and wellbeing of every child in 190 countries and territories, with a special focus on reaching those in greatest need.",33914,6236974,2694,24838,UNICEF,gov,UNICEF,United Nations,en
"UNOFFICIAL TWITTER – automated daily schedule of António Guterres, Portugal, 9th Secretary-General. Official account at @antonioguterres / @UN_Spokesperson @UN.",7546,271848,0,0,Unofficial Sec-Gen,,secgen,United Nations,en
Social Media Pros - We are a complete Social Media Solution for businesses and individuals looking to increase their social presence. Instant Services Available,17671,1443468,299381,374029,<ed><U+00A0><U+00BD><ed><U+00B2><U+00B0>Social Plug<ed><U+00A0><U+00BD><ed><U+00B2><U+00B0>,celeb,ItzBJJ,United States,en
"Mogul, First Rapper Ever To Write And Publish A Book at 19, Film Score, Composer, Producer,Director/Photo/Branding/Marketing/Historical Online Figure #BASED",147495,1389944,109300,1503737,Lil B THE BASEDGOD,celeb,LILBTHEBASEDGOD,United States,en
3x Pro Bowler 3x All Pro for the #SDChargers & #BuffaloBills. Now CEO of @LightsOutBrand. Visit: https://t.co/TomPsaaKnQ,32447,697982,12645,4885,Shawne Merriman,celeb,shawnemerriman,United States,en
"Tweets, herein, reflect views & opinions of Paymon Barati-Darmian, Attorney & Founder of https://t.co/gYf9X2NWwO & not that of Members, Employees or Clients.",16355,665447,596,421977,ChosenLawyers.com,bis,ChosenLawyers,United States,en
